{
  "$schema": "https://json-schema.org/draft/2020-12/schema",
  "type": "object",
  "additionalProperties": false,
  "required": [
    "identity",
    "state",
    "prepared_commit_sha",
    "workflow_sha256",
    "helper_sha256",
    "preflight_plan_sha256",
    "candidate_raw_hashes"
  ],
  "properties": {
    "identity": {
      "const": "provider-neutral-0008-fresh-readonly-preflight-20261007-r2"
    },
    "state": {
      "const": "CONSUMED_BEFORE_REMOTE"
    },
    "prepared_commit_sha": {
      "type": "string",
      "pattern": "^[a-f0-9]{40}$"
    },
    "workflow_sha256": {
      "type": "string",
      "pattern": "^[a-f0-9]{64}$"
    },
    "helper_sha256": {
      "type": "string",
      "pattern": "^[a-f0-9]{64}$"
    },
    "preflight_plan_sha256": {
      "type": "string",
      "pattern": "^[a-f0-9]{64}$"
    },
    "candidate_raw_hashes": {
      "const": {
        "serverless/migrations/0008_provider_neutral_roundtrip_backend.sql": "7734fe9ae6d950b5af444cc9a3f917b3da8d050c5e63083f51a79ea42d620bfe",
        "serverless/provider-neutral-backend-before.json": "02d8d6c9e0d131dfbfc4088af072ca704589f31e3753a59a80a10cd71b2e31b9",
        "serverless/provider-neutral-backend-after.json": "d0de3cd14ac3aa1afb55a358635c5a32a9c0f90528d1ca42f84ab4beb6fd54c3",
        "serverless/provider-neutral-backend-plan.json": "277fcf6ae8f465ae574e4c5f903b8c506689baf632a0e1e2d68ed2bd7dd5820a"
      }
    }
  }
}
