{
  "identity": "provider-neutral-0008-fresh-readonly-preflight-20261007-r2",
  "state": "CONSUMED_BEFORE_REMOTE",
  "prepared_commit_sha": "2b74f39310bc5dc5a050096434644126673f301e",
  "workflow_sha256": "36b5496f26e379dc2de49fdac7a04089d2142c1d60a21229145980a92d50cca7",
  "helper_sha256": "49a4496f2f5034b6eaf2ea58be266240b63ea4f1f4143db0c5190d63a9e142b1",
  "preflight_plan_sha256": "2d3aee45b8507fbefec88c897cd09722c3062fa91dd74b15a2c5ef0b06782f1f",
  "candidate_raw_hashes": {
    "serverless/migrations/0008_provider_neutral_roundtrip_backend.sql": "7734fe9ae6d950b5af444cc9a3f917b3da8d050c5e63083f51a79ea42d620bfe",
    "serverless/provider-neutral-backend-before.json": "02d8d6c9e0d131dfbfc4088af072ca704589f31e3753a59a80a10cd71b2e31b9",
    "serverless/provider-neutral-backend-after.json": "d0de3cd14ac3aa1afb55a358635c5a32a9c0f90528d1ca42f84ab4beb6fd54c3",
    "serverless/provider-neutral-backend-plan.json": "277fcf6ae8f465ae574e4c5f903b8c506689baf632a0e1e2d68ed2bd7dd5820a"
  }
}
